{
  "$schema": "https://json-schema.org/draft/2020-12/schema",
  "$id": "urn:portfolio-engineering-manual:2026-10-27:execution-receipt.schema.json",
  "title": "execution-receipt",
  "type": "object",
  "properties": {
    "schema_version": {
      "const": "1.0"
    },
    "repo": {
      "type": "string",
      "minLength": 1,
      "pattern": "\\S"
    },
    "mode": {
      "enum": [
        "production",
        "synthetic_example"
      ]
    },
    "source_sha": {
      "type": "string",
      "minLength": 1,
      "pattern": "^[0-9a-f]{40}$"
    },
    "audit_baseline_sha": {
      "type": "string",
      "minLength": 1,
      "pattern": "^[0-9a-f]{40}$"
    },
    "profile_sha": {
      "type": "string",
      "minLength": 1,
      "pattern": "^[0-9a-f]{40}$"
    },
    "policy_sha256": {
      "type": "string",
      "minLength": 1,
      "pattern": "^[0-9a-f]{64}$"
    },
    "created_at": {
      "type": "string",
      "minLength": 1,
      "pattern": "^\\d{4}-\\d{2}-\\d{2}T.+(?:Z|\\+00:00)$"
    },
    "overall_status": {
      "enum": [
        "PASS",
        "FAIL",
        "BLOCKED"
      ]
    },
    "input_files": {
      "type": "array",
      "items": {
        "type": "object",
        "properties": {
          "id": {
            "type": "string",
            "minLength": 1,
            "pattern": "^[A-Za-z0-9][A-Za-z0-9_.-]*$"
          },
          "kind": {
            "enum": [
              "lock",
              "asset",
              "configuration",
              "dataset"
            ]
          },
          "path": {
            "type": "string",
            "minLength": 1,
            "pattern": "\\S"
          },
          "sha256": {
            "type": "string",
            "minLength": 1,
            "pattern": "^[0-9a-f]{64}$"
          }
        },
        "required": [
          "id",
          "kind",
          "path",
          "sha256"
        ],
        "additionalProperties": false
      },
      "minItems": 0
    },
    "environments": {
      "type": "array",
      "items": {
        "type": "object",
        "properties": {
          "id": {
            "type": "string",
            "minLength": 1,
            "pattern": "^[A-Za-z0-9][A-Za-z0-9_.-]*$"
          },
          "status": {
            "enum": [
              "available",
              "blocked"
            ]
          },
          "reason": {
            "type": "string",
            "minLength": 1,
            "pattern": "\\S"
          },
          "tools": {
            "type": "object",
            "additionalProperties": {
              "type": "string",
              "minLength": 1,
              "pattern": "\\S"
            }
          }
        },
        "required": [
          "id",
          "status",
          "reason",
          "tools"
        ],
        "additionalProperties": false
      },
      "minItems": 1
    },
    "commands": {
      "type": "array",
      "items": {
        "type": "object",
        "properties": {
          "id": {
            "type": "string",
            "minLength": 1,
            "pattern": "^[A-Za-z0-9][A-Za-z0-9_.-]*$"
          },
          "command": {
            "type": "string",
            "minLength": 1,
            "pattern": "\\S"
          },
          "status": {
            "enum": [
              "passed",
              "failed",
              "blocked",
              "not_applicable"
            ]
          },
          "exit_code": {
            "type": [
              "integer",
              "null"
            ]
          },
          "started_at": {
            "type": "string",
            "minLength": 1,
            "pattern": "^\\d{4}-\\d{2}-\\d{2}T.+(?:Z|\\+00:00)$"
          },
          "finished_at": {
            "type": "string",
            "minLength": 1,
            "pattern": "^\\d{4}-\\d{2}-\\d{2}T.+(?:Z|\\+00:00)$"
          },
          "reason": {
            "type": "string",
            "minLength": 1,
            "pattern": "\\S"
          },
          "evidence_ids": {
            "type": "array",
            "items": {
              "type": "string",
              "minLength": 1,
              "pattern": "^[A-Za-z0-9][A-Za-z0-9_.-]*$"
            },
            "minItems": 0,
            "uniqueItems": true
          }
        },
        "required": [
          "id",
          "command",
          "status",
          "exit_code",
          "started_at",
          "finished_at",
          "reason",
          "evidence_ids"
        ],
        "additionalProperties": false
      },
      "minItems": 1
    },
    "test_families": {
      "type": "array",
      "items": {
        "type": "object",
        "properties": {
          "id": {
            "type": "string",
            "minLength": 1,
            "pattern": "^[A-Za-z0-9][A-Za-z0-9_.-]*$"
          },
          "status": {
            "enum": [
              "passed",
              "failed",
              "blocked",
              "not_applicable"
            ]
          },
          "reason": {
            "type": "string",
            "minLength": 1,
            "pattern": "\\S"
          },
          "evidence_ids": {
            "type": "array",
            "items": {
              "type": "string",
              "minLength": 1,
              "pattern": "^[A-Za-z0-9][A-Za-z0-9_.-]*$"
            },
            "minItems": 0,
            "uniqueItems": true
          },
          "tests": {
            "type": "array",
            "items": {
              "type": "object",
              "properties": {
                "id": {
                  "type": "string",
                  "minLength": 1,
                  "pattern": "^[A-Za-z0-9][A-Za-z0-9_.-]*$"
                },
                "status": {
                  "enum": [
                    "passed",
                    "failed",
                    "blocked",
                    "skipped"
                  ]
                },
                "reason": {
                  "type": "string",
                  "minLength": 1,
                  "pattern": "\\S"
                }
              },
              "required": [
                "id",
                "status",
                "reason"
              ],
              "additionalProperties": false
            },
            "minItems": 0
          },
          "counts": {
            "type": "object",
            "properties": {
              "collected": {
                "type": "integer",
                "minimum": 0
              },
              "executed": {
                "type": "integer",
                "minimum": 0
              },
              "passed": {
                "type": "integer",
                "minimum": 0
              },
              "failed": {
                "type": "integer",
                "minimum": 0
              },
              "skipped": {
                "type": "integer",
                "minimum": 0
              },
              "blocked": {
                "type": "integer",
                "minimum": 0
              }
            },
            "required": [
              "collected",
              "executed",
              "passed",
              "failed",
              "skipped",
              "blocked"
            ],
            "additionalProperties": false
          }
        },
        "required": [
          "id",
          "status",
          "reason",
          "evidence_ids",
          "tests",
          "counts"
        ],
        "additionalProperties": false
      },
      "minItems": 1
    },
    "artifacts": {
      "type": "array",
      "items": {
        "type": "object",
        "properties": {
          "id": {
            "type": "string",
            "minLength": 1,
            "pattern": "^[A-Za-z0-9][A-Za-z0-9_.-]*$"
          },
          "kind": {
            "type": "string",
            "minLength": 1,
            "pattern": "^[A-Za-z0-9][A-Za-z0-9_.-]*$"
          },
          "environment": {
            "type": "string",
            "minLength": 1,
            "pattern": "^[A-Za-z0-9][A-Za-z0-9_.-]*$"
          },
          "path": {
            "type": "string",
            "minLength": 1,
            "pattern": "\\S"
          },
          "sha256": {
            "type": "string",
            "minLength": 1,
            "pattern": "^[0-9a-f]{64}$"
          },
          "created_at": {
            "type": "string",
            "minLength": 1,
            "pattern": "^\\d{4}-\\d{2}-\\d{2}T.+(?:Z|\\+00:00)$"
          },
          "source_sha": {
            "type": "string",
            "minLength": 1,
            "pattern": "^[0-9a-f]{40}$"
          },
          "profile_sha": {
            "type": "string",
            "minLength": 1,
            "pattern": "^[0-9a-f]{40}$"
          },
          "evidence_kind": {
            "enum": [
              "real",
              "synthetic"
            ]
          },
          "qualification": {
            "type": "object",
            "properties": {
              "status": {
                "enum": [
                  "passed",
                  "failed",
                  "blocked",
                  "not_applicable"
                ]
              },
              "reason": {
                "type": "string",
                "minLength": 1,
                "pattern": "\\S"
              },
              "command_ids": {
                "type": "array",
                "items": {
                  "type": "string",
                  "minLength": 1,
                  "pattern": "^[A-Za-z0-9][A-Za-z0-9_.-]*$"
                },
                "minItems": 0,
                "uniqueItems": true
              },
              "test_family_ids": {
                "type": "array",
                "items": {
                  "type": "string",
                  "minLength": 1,
                  "pattern": "^[A-Za-z0-9][A-Za-z0-9_.-]*$"
                },
                "minItems": 0,
                "uniqueItems": true
              },
              "evidence_ids": {
                "type": "array",
                "items": {
                  "type": "string",
                  "minLength": 1,
                  "pattern": "^[A-Za-z0-9][A-Za-z0-9_.-]*$"
                },
                "minItems": 0,
                "uniqueItems": true
              }
            },
            "required": [
              "status",
              "reason",
              "command_ids",
              "test_family_ids",
              "evidence_ids"
            ],
            "additionalProperties": false
          }
        },
        "required": [
          "id",
          "kind",
          "environment",
          "path",
          "sha256",
          "created_at",
          "source_sha",
          "profile_sha",
          "evidence_kind",
          "qualification"
        ],
        "additionalProperties": false
      },
      "minItems": 0
    },
    "coverage_scopes": {
      "type": "array",
      "items": {
        "type": "object",
        "properties": {
          "id": {
            "type": "string",
            "minLength": 1,
            "pattern": "^[A-Za-z0-9][A-Za-z0-9_.-]*$"
          },
          "status": {
            "enum": [
              "passed",
              "failed",
              "blocked",
              "not_applicable"
            ]
          },
          "reason": {
            "type": "string",
            "minLength": 1,
            "pattern": "\\S"
          },
          "environment": {
            "type": "string",
            "minLength": 1,
            "pattern": "^[A-Za-z0-9][A-Za-z0-9_.-]*$"
          },
          "command_id": {
            "type": "string",
            "minLength": 1,
            "pattern": "^[A-Za-z0-9][A-Za-z0-9_.-]*$"
          },
          "measurement": {
            "enum": [
              "line",
              "branch",
              "line_and_branch",
              "none"
            ]
          },
          "included_roots": {
            "type": "array",
            "items": {
              "type": "string",
              "minLength": 1,
              "pattern": "\\S"
            },
            "minItems": 0,
            "uniqueItems": true
          },
          "excluded_roots": {
            "type": "array",
            "items": {
              "type": "string",
              "minLength": 1,
              "pattern": "\\S"
            },
            "minItems": 0,
            "uniqueItems": true
          },
          "artifact_ids": {
            "type": "array",
            "items": {
              "type": "string",
              "minLength": 1,
              "pattern": "^[A-Za-z0-9][A-Za-z0-9_.-]*$"
            },
            "minItems": 0,
            "uniqueItems": true
          },
          "evidence_ids": {
            "type": "array",
            "items": {
              "type": "string",
              "minLength": 1,
              "pattern": "^[A-Za-z0-9][A-Za-z0-9_.-]*$"
            },
            "minItems": 0,
            "uniqueItems": true
          }
        },
        "required": [
          "id",
          "status",
          "reason",
          "environment",
          "command_id",
          "measurement",
          "included_roots",
          "excluded_roots",
          "artifact_ids",
          "evidence_ids"
        ],
        "additionalProperties": false
      },
      "minItems": 1
    },
    "evidence": {
      "type": "array",
      "items": {
        "type": "object",
        "properties": {
          "id": {
            "type": "string",
            "minLength": 1,
            "pattern": "^[A-Za-z0-9][A-Za-z0-9_.-]*$"
          },
          "path": {
            "type": "string",
            "minLength": 1,
            "pattern": "\\S"
          },
          "sha256": {
            "type": "string",
            "minLength": 1,
            "pattern": "^[0-9a-f]{64}$"
          },
          "captured_at": {
            "type": "string",
            "minLength": 1,
            "pattern": "^\\d{4}-\\d{2}-\\d{2}T.+(?:Z|\\+00:00)$"
          },
          "source_sha": {
            "type": "string",
            "minLength": 1,
            "pattern": "^[0-9a-f]{40}$"
          },
          "profile_sha": {
            "type": "string",
            "minLength": 1,
            "pattern": "^[0-9a-f]{40}$"
          },
          "kind": {
            "enum": [
              "real",
              "synthetic"
            ]
          },
          "description": {
            "type": "string",
            "minLength": 1,
            "pattern": "\\S"
          }
        },
        "required": [
          "id",
          "path",
          "sha256",
          "captured_at",
          "source_sha",
          "profile_sha",
          "kind",
          "description"
        ],
        "additionalProperties": false
      },
      "minItems": 0
    },
    "standards": {
      "type": "array",
      "items": {
        "type": "object",
        "properties": {
          "id": {
            "type": "string",
            "minLength": 1,
            "pattern": "^[A-Za-z0-9][A-Za-z0-9_.-]*$"
          },
          "status": {
            "enum": [
              "passed",
              "failed",
              "blocked",
              "not_applicable"
            ]
          },
          "reason": {
            "type": "string",
            "minLength": 1,
            "pattern": "\\S"
          },
          "evidence_ids": {
            "type": "array",
            "items": {
              "type": "string",
              "minLength": 1,
              "pattern": "^[A-Za-z0-9][A-Za-z0-9_.-]*$"
            },
            "minItems": 0,
            "uniqueItems": true
          }
        },
        "required": [
          "id",
          "status",
          "reason",
          "evidence_ids"
        ],
        "additionalProperties": false
      },
      "minItems": 15
    },
    "tasks": {
      "type": "array",
      "items": {
        "type": "object",
        "properties": {
          "id": {
            "type": "string",
            "minLength": 1,
            "pattern": "^[A-Za-z0-9][A-Za-z0-9_.-]*$"
          },
          "status": {
            "enum": [
              "passed",
              "failed",
              "blocked",
              "not_applicable"
            ]
          },
          "reason": {
            "type": "string",
            "minLength": 1,
            "pattern": "\\S"
          },
          "evidence_ids": {
            "type": "array",
            "items": {
              "type": "string",
              "minLength": 1,
              "pattern": "^[A-Za-z0-9][A-Za-z0-9_.-]*$"
            },
            "minItems": 0,
            "uniqueItems": true
          }
        },
        "required": [
          "id",
          "status",
          "reason",
          "evidence_ids"
        ],
        "additionalProperties": false
      },
      "minItems": 6
    },
    "exceptions": {
      "type": "array",
      "items": {
        "type": "object",
        "properties": {
          "id": {
            "type": "string",
            "minLength": 1,
            "pattern": "^[A-Za-z0-9][A-Za-z0-9_.-]*$"
          },
          "evidence_ids": {
            "type": "array",
            "items": {
              "type": "string",
              "minLength": 1,
              "pattern": "^[A-Za-z0-9][A-Za-z0-9_.-]*$"
            },
            "minItems": 1,
            "uniqueItems": true
          }
        },
        "required": [
          "id",
          "evidence_ids"
        ],
        "additionalProperties": false
      },
      "minItems": 0
    }
  },
  "required": [
    "schema_version",
    "repo",
    "mode",
    "source_sha",
    "audit_baseline_sha",
    "profile_sha",
    "policy_sha256",
    "created_at",
    "overall_status",
    "input_files",
    "environments",
    "commands",
    "test_families",
    "artifacts",
    "coverage_scopes",
    "evidence",
    "standards",
    "tasks",
    "exceptions"
  ],
  "additionalProperties": false
}
