{
  "schema_version": "1.0",
  "repo": "strmt7/qfales_fc_website",
  "mode": "synthetic_example",
  "source_sha": "f455a4e36c0b9541edb6f0207b2870b0369b5f3a",
  "audit_baseline_sha": "f455a4e36c0b9541edb6f0207b2870b0369b5f3a",
  "profile_sha": "1111111111111111111111111111111111111111",
  "policy_sha256": "94c7196f36d72789d9234746ae0b6c71996300544e5a74a830372a541091eb14",
  "created_at": "2026-10-27T21:46:28Z",
  "overall_status": "BLOCKED",
  "input_files": [
    {
      "id": "example-lock",
      "kind": "lock",
      "path": "inputs/example.lock",
      "sha256": "3e8011ce577caa7d30eb6380e57f2b4a1834a4826f5e0552bed2389c0877f4d1"
    }
  ],
  "environments": [
    {
      "id": "example-host",
      "status": "blocked",
      "reason": "Synthetic metadata only",
      "tools": {}
    }
  ],
  "commands": [
    {
      "id": "example-check",
      "command": "npm test",
      "status": "blocked",
      "exit_code": null,
      "started_at": "2026-10-27T21:46:13Z",
      "finished_at": "2026-10-27T21:46:18Z",
      "reason": "Synthetic required host unavailable",
      "evidence_ids": []
    }
  ],
  "test_families": [
    {
      "id": "example-unit",
      "status": "blocked",
      "reason": "Synthetic required host unavailable",
      "evidence_ids": [],
      "tests": [],
      "counts": {
        "collected": 0,
        "executed": 0,
        "passed": 0,
        "failed": 0,
        "skipped": 0,
        "blocked": 0
      }
    }
  ],
  "artifacts": [],
  "coverage_scopes": [
    {
      "id": "example-coverage",
      "status": "blocked",
      "reason": "Synthetic required host unavailable",
      "environment": "example-host",
      "command_id": "example-check",
      "measurement": "line",
      "included_roots": [
        "src"
      ],
      "excluded_roots": [
        "generated",
        "vendor",
        "tests/fixtures"
      ],
      "artifact_ids": [],
      "evidence_ids": []
    }
  ],
  "evidence": [
    {
      "id": "example-log",
      "path": "logs/example.log",
      "sha256": "0d8384223f8e9df88f866a5ea688dd8850330979519d401074e99b212f83d380",
      "captured_at": "2026-10-27T21:46:23Z",
      "source_sha": "f455a4e36c0b9541edb6f0207b2870b0369b5f3a",
      "profile_sha": "1111111111111111111111111111111111111111",
      "kind": "synthetic",
      "description": "Synthetic fixture; no real command log"
    }
  ],
  "standards": [
    {
      "id": "S01",
      "status": "blocked",
      "reason": "Synthetic required host unavailable",
      "evidence_ids": []
    },
    {
      "id": "S02",
      "status": "blocked",
      "reason": "Synthetic required host unavailable",
      "evidence_ids": []
    },
    {
      "id": "S03",
      "status": "blocked",
      "reason": "Synthetic required host unavailable",
      "evidence_ids": []
    },
    {
      "id": "S04",
      "status": "blocked",
      "reason": "Synthetic required host unavailable",
      "evidence_ids": []
    },
    {
      "id": "S05",
      "status": "blocked",
      "reason": "Synthetic required host unavailable",
      "evidence_ids": []
    },
    {
      "id": "S06",
      "status": "blocked",
      "reason": "Synthetic required host unavailable",
      "evidence_ids": []
    },
    {
      "id": "S07",
      "status": "blocked",
      "reason": "Synthetic required host unavailable",
      "evidence_ids": []
    },
    {
      "id": "S08",
      "status": "blocked",
      "reason": "Synthetic required host unavailable",
      "evidence_ids": []
    },
    {
      "id": "S09",
      "status": "blocked",
      "reason": "Synthetic required host unavailable",
      "evidence_ids": []
    },
    {
      "id": "S10",
      "status": "blocked",
      "reason": "Synthetic required host unavailable",
      "evidence_ids": []
    },
    {
      "id": "S11",
      "status": "blocked",
      "reason": "Synthetic required host unavailable",
      "evidence_ids": []
    },
    {
      "id": "S12",
      "status": "blocked",
      "reason": "Synthetic required host unavailable",
      "evidence_ids": []
    },
    {
      "id": "S13",
      "status": "blocked",
      "reason": "Synthetic required host unavailable",
      "evidence_ids": []
    },
    {
      "id": "S14",
      "status": "blocked",
      "reason": "Synthetic required host unavailable",
      "evidence_ids": []
    },
    {
      "id": "S15",
      "status": "blocked",
      "reason": "Synthetic required host unavailable",
      "evidence_ids": []
    }
  ],
  "tasks": [
    {
      "id": "QFALES-01",
      "status": "blocked",
      "reason": "Synthetic required host unavailable",
      "evidence_ids": []
    },
    {
      "id": "QFALES-02",
      "status": "blocked",
      "reason": "Synthetic required host unavailable",
      "evidence_ids": []
    },
    {
      "id": "QFALES-03",
      "status": "blocked",
      "reason": "Synthetic required host unavailable",
      "evidence_ids": []
    },
    {
      "id": "QFALES-04",
      "status": "blocked",
      "reason": "Synthetic required host unavailable",
      "evidence_ids": []
    },
    {
      "id": "QFALES-05",
      "status": "blocked",
      "reason": "Synthetic required host unavailable",
      "evidence_ids": []
    },
    {
      "id": "QFALES-06",
      "status": "blocked",
      "reason": "Synthetic required host unavailable",
      "evidence_ids": []
    }
  ],
  "exceptions": []
}
